{
  "checks": {
    "all_model_task_and_claim_boundaries_closed": true,
    "closed_preparation_schema": true,
    "closed_result_schema": true,
    "five_wheel_reader_tests_pass": true,
    "inventory_has_no_network_install_extract_or_decrypt": true,
    "official_release_is_exactly_pinned": true,
    "output_is_atomic_and_does_not_copy_member_bytes": true,
    "prior_source_design_hashes_match": true,
    "reader_uses_standard_library_only": true,
    "runner_does_not_import_or_install_appworld": true,
    "runner_requires_revision_cleanliness_and_external_absolute_wheel": true,
    "zip_limits_are_positive_and_bounded": true
  },
  "config_sha256": "94451e1cd1f6bd55ddd954956280a72737fb32c3588d33d3d7fc72e0544f315e",
  "gpu_used": false,
  "inventory_implementation_sha256": "113efb53d69eafe7a01239eaaca1492725d523aeb0276a90f7306d90ed64d0b3",
  "model_loaded": false,
  "next_gate": "retrieve_one_pinned_wheel_and_run_read_only_inventory",
  "official_wheel_sha256": "db77f8003982502383a50fa2974983894bd1c54f64e2fd3f7e1540d5edd037eb",
  "passed": true,
  "protected_bundle_opened": false,
  "remote_wheel_inventory_authorized": true,
  "run_kind": "proper_v2_3_appworld_offline_wheel_inventory_preparation",
  "runner_sha256": "be6e9acfb146892b9320c823cc46bfc420e8b763459b9aead0e673824ccecc56",
  "schema_version": 1,
  "source_install_authorized": false,
  "task_or_api_data_read": false,
  "tests_run": 5,
  "wheel_downloaded": false,
  "wheel_extracted": false,
  "wheel_read": false
}
